{
  "contract": 1,
  "id": "ai-era-education",
  "title": "AI 時代，教育真正要改變什麼？",
  "version": "2026-10-17",
  "entry": "index.html",
  "runtime": "timeline",
  "segments": [
    {
      "group": "開場",
      "title": "五站路線",
      "duration": 10
    },
    {
      "group": "開場",
      "title": "三個問題",
      "duration": 13
    },
    {
      "group": "01 世界",
      "title": "教師先行",
      "duration": 15
    },
    {
      "group": "01 世界",
      "title": "人機協作",
      "duration": 14
    },
    {
      "group": "02 台灣",
      "title": "進入日常",
      "duration": 14
    },
    {
      "group": "02 台灣",
      "title": "效率到價值",
      "duration": 13
    },
    {
      "group": "03 學校",
      "title": "錯誤迴圈",
      "duration": 13
    },
    {
      "group": "03 學校",
      "title": "支持系統",
      "duration": 15
    },
    {
      "group": "04 教師",
      "title": "新增價值",
      "duration": 13
    },
    {
      "group": "04 教師",
      "title": "保留卸載擴張",
      "duration": 15
    },
    {
      "group": "05 學生",
      "title": "表現≠學習",
      "duration": 15
    },
    {
      "group": "05 學生",
      "title": "學習證據",
      "duration": 14
    },
    {
      "group": "06 AI 素養",
      "title": "學習迴圈",
      "duration": 15
    },
    {
      "group": "06 AI 素養",
      "title": "獨角仙復育",
      "duration": 15
    },
    {
      "group": "06 AI 素養",
      "title": "皮影戲創作",
      "duration": 13
    },
    {
      "group": "結語",
      "title": "三個帶走",
      "duration": 16
    }
  ],
  "pages": [
    {
      "type": "anim",
      "seg": 0,
      "text": "字幕：從世界、台灣、學校、教師一路走到學生，看 AI 時代的教育要改什麼。\n畫面文字：\nAI 時代，教育真正要改變什麼？\n從國際發展到台灣現場，從學校治理到學生 AI 素養\n世界\n趨勢與共識\n2\n台灣\n現況與案例\n3\n學校\n治理與支持\n4\n教師\n動機與專業\n5\n學生\n素養與作品"
    },
    {
      "type": "anim",
      "seg": 1,
      "text": "字幕：今天不教更多工具，先回答三題：AI 能支援什麼、人要親自做什麼、什麼證據顯示學習。\n畫面文字：\n今天不教「更多工具」\n先回答三個教育問題\n01\nAI 可以支援什麼？\n哪些工作適合交給 AI，\n真的能省時間或擴大視野？\n02\n人必須親自完成什麼？\n哪些思考太早外包，\n學習就可能被拿走？\n03\n什麼證據顯示學習？\n作品變好時，怎麼知道\n變好的是學生，不是 AI？\n這三題，會貫穿整場"
    },
    {
      "type": "anim",
      "seg": 2,
      "text": "字幕：愛沙尼亞、韓國、新加坡、荷蘭路徑不同，共識相同：Teachers first，科技不會自己改變教育。\n畫面文字：\n01｜世界：國際發展\n教師專業\n路徑不同，共識相同：教師先行\n愛沙尼亞\nTeachers first\n教師 → PLC → 學校 → 學生\n韓國\n理解 → 應用 → 反思\n教師是課程變革的主體\n來源：愛沙尼亞、韓國、新加坡、荷蘭國際論壇簡報\n新加坡\nPedagogical Layer\n保留有價值的苦思\n荷蘭\nHuman–AI 協作\n互補、增能，不只自動化\n“Technology does not transform education. Teachers do.”"
    },
    {
      "type": "anim",
      "seg": 3,
      "text": "字幕：AI 可以取代、互補、增能；越靠近判斷與責任，人的主導權越重要。\n畫面文字：\n01｜世界：人機協作\n越靠近判斷與責任，人越要主導\nREPLACE\n取代\n重複、標準化、低風險\n來源：Molenaar（荷蘭）人機協作；新加坡 Student Learning Space\nCOMPLEMENT\n互補\n補充資訊、比較選項\nAUGMENT\n增能\n支援規劃、反思、判斷\n低風險、可重複\n人的主導權 ↑\n判斷、解釋、責任\n好的教育 AI 不一定越順越好：要保留必要的思考摩擦"
    },
    {
      "type": "disc",
      "kind": "vote",
      "kicker": "討論｜01 世界",
      "title": "你的學校目前比較像哪一階段？",
      "prompt": "先不談工具名稱，只談教學價值與支持系統。",
      "options": [
        "工具先行",
        "教師先行",
        "教學系統先行"
      ]
    },
    {
      "type": "anim",
      "seg": 4,
      "text": "字幕：AI 已經進入備課、教材與公文；但效率資料不等於學習成效。\n畫面文字：\n02｜台灣：現況\n日常備課\n6.15%\nAI 已經進入教師的日常工作流\n52.01%\n75.03%\n教材／題目生成\n26.53%\n來源：施信源〈新北 AI 教育萬人實踐〉教師使用情境調查（自陳資料）\n83.08%\n60.74%\n公文輔助生成\n0.00%\n84.04%\n76.12%\n35.73%\n80.20%\n57.17%\n計畫書／成果報告\n12.81%\n80.36%\n65.45%\n42.54%\n66.84%\n56.72%\n61.11%\n61.44%\n效率 ≠ 學習成效"
    },
    {
      "type": "anim",
      "seg": 5,
      "text": "字幕：下一步：把省下的時間，重新投資到教學判斷與學生回饋。\n畫面文字：\n02｜台灣：下一步\n從效率走向教育價值\n效率層\n省多少時間？\n少了哪些重複工作？\n教學層\n任務有沒有改變？\n教師判斷是否提升？\n學習層\n學生更能理解、\n遷移、解釋與反思？\n省下的時間，\n要重新投資到\n判斷、回饋與對話"
    },
    {
      "type": "anim",
      "seg": 6,
      "text": "字幕：買工具、辦研習、要求使用、缺乏支持——帳號不等於推動策略。\n畫面文字：\n03｜學校：治理\n買工具\n快速可見\n學校推 AI 最常見的錯誤迴圈\n辦研習\n短期熱度\n要求使用\n形成壓力\n缺乏支持\n回到各自摸索\n原地打轉\n熱度過了，又各自摸索\n帳號 ≠ 推動策略"
    },
    {
      "type": "anim",
      "seg": 7,
      "text": "字幕：治理、能力、社群、證據四層缺一不可；成熟度要看能不能持續修正。\n畫面文字：\n03｜學校：支持系統\n1｜治理\n個資・資安・著作權・責任\n四層缺一不可，從安全感到證據\n來源：許庭嘉、施信源論壇資料\n2｜能力\n初階／進階・教學行政分流\n3｜社群\nPLC・案例庫・種子教師\n4｜證據\n效率 → 教學 → 學習\n成熟度不只看使用率\n有人在用\n個人探索\nL1\n有規範\n降低風險\nL2\n有共備\n共同語言\nL3\n有證據\n可修正\nL4"
    },
    {
      "type": "disc",
      "kind": "map",
      "kicker": "討論｜03 學校・20 分鐘",
      "title": "畫出學校的阻塞點地圖",
      "prompt": "從業務開始，不從工具開始：選節點、標阻塞類型，寫一件高頻工作。",
      "nodes": [
        "校務治理",
        "教務與課程",
        "學務與學生支持",
        "輔導／特教",
        "總務／採購／設備",
        "導師／年級／PLC",
        "家長／社區",
        "資料／評量／成果"
      ],
      "tags": [
        {
          "label": "最花時間",
          "color": "#f2c14e"
        },
        {
          "label": "最機械化",
          "color": "#7fb6d9"
        },
        {
          "label": "最常等待",
          "color": "#e8875b"
        },
        {
          "label": "責任不清",
          "color": "#e66a5c"
        }
      ]
    },
    {
      "type": "disc",
      "kind": "vote",
      "kicker": "討論｜03 學校",
      "title": "如果只有一筆 AI 預算，你先投資哪一項？",
      "prompt": "哪一項最能讓一年後的老師「更會判斷」？",
      "options": [
        "工具",
        "研習",
        "種子教師",
        "共備時間",
        "規範",
        "案例庫"
      ]
    },
    {
      "type": "anim",
      "seg": 8,
      "text": "字幕：不需要為 AI 而 AI：新增價值要大於成本與風險才值得用。\n畫面文字：\n04｜教師：動機\n成本與風險\n新增價值\n學習時間\n不需要為 AI 而 AI：看新增價值\n資料風險\n查核負擔\n大量比較\n盲點搜尋\n差異化鷹架\n挑戰自己的教案\n最有價值：原本做不到的分析、回饋或差異化，因 AI 變得可行"
    },
    {
      "type": "anim",
      "seg": 9,
      "text": "字幕：形成中的能力保留、重複工作卸載、找反例與新觀點用 AI 擴張。\n畫面文字：\n04｜教師：專業判斷\n保留\n形成中的核心能力\n卸載\n成熟、重複、低風險\n認知工作分配：保留・卸載・擴張\n擴張\n反例、觀點、替代假設\n這件工作，該交給 AI 嗎？\n第一次推理\n來源：許庭嘉〈Deepening Teacher AI Literacy〉；Cukurova 論壇簡報\n排版格式\n找反例\n判斷答案是否合適\n初步分類\n不同觀點\n核心能力：知道什麼該交、什麼不能交"
    },
    {
      "type": "disc",
      "kind": "wall",
      "kicker": "討論｜04 教師",
      "title": "省下每週 2 小時，要重新投資在哪裡？",
      "prompt": "學生回饋？共備？觀課？閱讀？個別支持？寫下你的選擇與理由。"
    },
    {
      "type": "anim",
      "seg": 10,
      "text": "字幕：有 AI 時練習表現大幅提升，離開 AI 後卻未必更會。\n畫面文字：\n05｜學生：學習\n有 AI 陪著練習時\nGPT base\nGPT tutor\n作品變好 ≠ 學習變好\n+30%\n+79%\n來源：Bastani et al.（AI 輔助練習實驗）；Cukurova〈From Replacement to Synergy〉\n+43%\n+113%\n+47%\n+126%\n+48%\n+127%\n離開 AI 之後\n−11%\n無顯著提升\n−15%\n−17%\n≠\n表現提升，不等於能力已經形成"
    },
    {
      "type": "anim",
      "seg": 11,
      "text": "字幕：評量要看歷程：初始想法、使用歷程、判斷理由、離開 AI 的表現。\n畫面文字：\n05｜學生：評量\nAI 前\n初始想法\nAI 時代的評量：收集歷程證據\n2\n使用中\n提示與歷程\n3\n判斷\n接受／拒絕的理由\n4\n離開 AI\n獨立遷移表現\n學生離開 AI 後，還會什麼？\n獨立說明、重做、遷移題、提示紀錄、修訂理由——都可能比成品更重要"
    },
    {
      "type": "disc",
      "kind": "wall",
      "kicker": "討論｜05 學生",
      "title": "作品很好，學生卻說不出原因，你會怎麼評量？",
      "prompt": "什麼證據能讓你放心地說：「這是學生的能力」？"
    },
    {
      "type": "anim",
      "seg": 12,
      "text": "字幕：先嘗試、再用 AI、再查核、再修正，每一輪讓 AI 退場一點。\n畫面文字：\n06｜學生 AI 素養\n先嘗試\n先想，再用，再查，再改\nAI 支援\n查核證據\n來源：許庭嘉 AI Learning Loop（Initial attempt → … → Reflection & fading）\n修正說明\n反思淡出\n第 1 輪\n先留下自己的想法\n第 2 輪\nAI 退場一點，下次少依賴\n有 AI、沒 AI\n都保持能力"
    },
    {
      "type": "anim",
      "seg": 13,
      "text": "字幕：不只秀成品：從遊戲困惑到 micro:bit 與復育日誌，證據越完整越能說是學生學會。\n畫面文字：\n06｜學生作品：案例判讀\n飼育遊戲\n先玩，留下困惑\n校園獨角仙復育：不要只秀成品\n研究問題\nAI 協助整理與查證\nmicro:bit\n轉成感測設計\n公開示範：圖像為匿名教學示意圖，非真實課堂證據；不推論 AI 造成學習成效\n復育日誌\n持續觀察與修正\n證據弱\n證據強\n低證據\n只有遊戲分數或成品\n看得到結果，看不到思考\n飼育進度\n85 分\n過關！★★★\n？ 誰在思考\n中證據\n學習單、AI 對話、重試紀錄\n看得到探究歷程\n幼蟲為什麼都不動？\n可能和溫度、濕度有關\n我要查證後再試一次\n↻ 第 2 次嘗試\n高證據\n原始困惑、查證、感測數據、修正理由\n看得到學生如何判斷與修正\n濕度 %\n太乾 → 噴水\n再觀察 3 天\n證據越完整，越能說「是學生學會了」"
    },
    {
      "type": "anim",
      "seg": 14,
      "text": "字幕：學生負責故事與判斷，AI 協助風格轉換、骨架與分鏡。\n畫面文字：\n06｜學生作品 × AI 創作\n讀／踏查\n建立地方脈絡\n學生負責故事，AI 幫它動起來\n畫／寫\n留下自己的版本\nAI 轉換\n重建皮影骨架\n人＋AI\n分鏡／旁白\n安排鏡頭節奏\n播放／分享\n可動、可談、可修正\n教師把關\n・史實與著作權\n・學生的故事判斷\n・離開 AI 後能否說明\n同一個 Skill\n・北社尾歷史・渡海\n・神話・后羿射日\n・繪本動畫\nAI 是作品轉譯工具，不是代寫故事的工具"
    },
    {
      "type": "disc",
      "kind": "cols",
      "kicker": "討論｜06 微實作・15 分鐘",
      "title": "三格判斷：AI、學生、證據",
      "prompt": "先想一個教學任務，再把工作分進三格。",
      "columns": [
        "AI 可以做",
        "學生必須自己做",
        "用什麼證據確認"
      ]
    },
    {
      "type": "anim",
      "seg": 15,
      "text": "字幕：思考方向、判斷標準與最後責任，仍應留在人身上。\n畫面文字：\n三個 Takeaway\n01\nAI 可以支援什麼？\n02\n教師與學生必須親自完成什麼？\n03\n什麼證據顯示學習真的發生？\nAI 可以讓孩子做以前做不到的事；\n但思考方向、判斷標準與最後責任，仍應留在人身上。\nTeacher judgment × Student agency × Learning evidence"
    }
  ]
}
