{
  "contract": 1,
  "id": "m10-forged-msg",
  "title": "偽造父頁訊息",
  "version": "2026-10-17",
  "entry": "index.html",
  "runtime": "timeline",
  "segments": [
    {
      "group": "測試",
      "title": "Attack",
      "duration": 10
    }
  ],
  "pages": [
    {
      "type": "anim",
      "seg": 0,
      "text": "惡意樣本：攻擊在執行時才發生。"
    }
  ]
}
